text,label
تن دکمه فیزیک دیگر رو دستگاه می‌بین قسم لبه بالا دستگاه قرار دارد مربوط روشن خامو کردن نمایشگر می‌باشد .,1
نظر من گوش هر لحاظ نسب قیم کارا نسب مدل دیگر برتر داره تن فرق گوش آرک اس سیپیو اندازه صفحه نما ودوربین ۸ مگاپیکسل آرک اس هس من دو هفته هست خود گوشیمو راحت اندروید ۴ آپگرید کرد نصب اندروید ۴ رو گوش خیل خیل خیل راض تو اندروید ۴ مشکل ۱۲۰ ثانیه بلوتوث حل‌شده می‌تونید تو تنظ مد ز شناسا تغییر بدید اینکه مثل من کلا بر دارید ، همچ مثل وایر لس ، و پ  ، دوربین ، بلوتوث .,2
نظر بگیر ۶ D قیمت همین حدود داشته_باشد ، بنابراین واقعا فول فریم انقلاب هستند .,2
پاسخ دوست مورد گوشی ایران نظر دادن ، باید بگ اتفاقا خیل خوبه گوشی رو مقایسه کن برتری هر کدو رو معرف کن .,1
دراثراستفاده ناصحیح پین mini usb کابل دچارمشکل میشه باعث قطع وصل مکرر آسیب هارد میشه مجبور کابل دیگه تهیه کن .,1
تبل جواب new ipad اومده نظر بد جور اونو شکس داده .,2
قسم پ دستگاه نیز سوک  ورود پاور ، کانکشن USB Transparency Adapter قرار گرفته‌اند .,1
همانطور گفت ، S ۳۲۰۰ دوربین بریج سطح متوسط .,0
واقعا هارد خوبیه تو جیب عقب میشه بذار خیل سبکه این من خرید ساخ مالزیه ول جنس رو اونقدرا فکر می‌کرد براق نیس,2
بنابراین باید دق کنید هنگا عکاس دس شما لرز نداشته_باشد .,1
کنون نسب حت S ۵ ۸ مگاپیکسله کیفیت کمتره !,0
ابعاد ۴۱۵ x ۲۶۵ x ۲۵۰ میلی می‌باشد وزن نیز حدود ۷ کیلوگر می‌رسد وزن نسبتا ک محسوب می‌گردد .,2
انرژ دوربین نیز طریق چهار باتر قلم سایز AA تامین می‌شود بسته اینکه انواع آلکالاین ، نیکل-متال هیبرید لیتیوم انتخاب کنید می‌تواند شارژده اندازه ۳۰۰ ، ۵۰۰ ۷۰۰ عکس داشته_باشد .,1
XBOX ۳۶۰ حال حاضر سه مدل درایو مختلف ساخته_می‌شود : • Samsung / Toshiba • LG / Hitachi • Benq هر سه مدل نیز دارا ورژن مختلف هستند این‌جا ذکر آن خوددار می‌کن .,1
همیشه اتصال اینترن تلویزیون من مه همین خاطر تلویزیون رو انتخاب کرد .,2
امک تغییر دست : تغییر بازشدگ دیافراگ ، سرع شا ایزوافزا ایزو ۱۲۸۰۰ مدل پیشین ۳۲۰۰ .,1
تن ایراد دوربین کم هس اینکه ۸ مگاپیکسله سنسور exmor داره کیف عکس درحد همون کا ۷۵۰ ب نیس !,0
اندروید نسخه ۴ ٫ ۱.۲ ، تو تنظ حال نرمال رو انتخاب کن میشه ۱۳ مگاپیکسل ۱۲ واسه حال superior auto هس,1
نظر من گوش htc xperia Z سر سون .,0
معایب ، صدا ک بلندگو خارج کیف پایین صفحه نما زیر نور آفتابه .,0
کمپان اپل انتظار بیشتر دا .,1
تن سختی دارد آنه مایکروساف گفته آپد سیس ماه آت مشکل نیز مرتفع می‌نماید دشواری عد امک استفاده VPN .,0
ابعاد ۱۶ ۳ ۱۷ ۴ X ۱۸ ٫ ۶ پرین نسبتا بزرگ دارد قرار دادن رو میز کار نسبتا جاگیر باشد .,0
طور نمایشگر iPhone ، ۱۶۰ dpi نمایشگر iPod ، ۱۶۳ dpi .,1
عنو عضو جدید صفحه‌کلید کشو QWERTY خانواده Xperia  گوشی سون اریکسون ، شاید Xperia Pro اندازه اعضا X ۸ X ۱۰ جذاب نباشد ، ول می‌تو Xperia Neoا کم قطور بزرگ بسیار ویژگی یکس پردازنده ۱ GHz Snapdragon سیستم‌عامل Android ۲ ٫ ۳ دانس .,1
عوض مدل کانن دارا فقط ۳۲ گیگابا حافظه داخل خشک .,1
کیف تصویر نسب ۴ s واقعا بالاتره .,2
همانطور نقد بررس D ۶۰۰ گفت ، تاریخچه دوربین DSLR فول فر تقریبا سال ۲۰۰۲ Canon EOS ۱ Ds می‌گردد .,1
بخواه رقیب دستگاه معرف کن ، تن می‌تو لپ‌تاپ فوق باریک زیبا سامسونگ سر ۹ اشاره کرد کیف ساخ نیز Retina MacBook Pro برابر می‌کنند .,1
سلا واقعا گوشیه قدرتمند هست چنین پردازنده تو xperia z کار رفته رزولوشن اون ۱۰۸۰ p قدر بیشتر cpu gpu میگیره ول hd کار cpu راح تره !,2
نوع اول توسط شرک LG هیتاچ طراحی‌شده هنگا فعال کم نویز قابل شنیدن محیط ایجاد می‌کرد .,0
حالا می‌توانید قابل بهبود دهنده گسترده رنگ پلاس ، رنگ درس همانطور باید دیده_شوند مشاهده کنید .,1
سوال : آیا زب کنسول بازی ورژن NTSC-J ژاپن ؟,1
صفحه نما رتینا - سبک باریک .,2
دوربین شوتینگ مود مختلف دارد طریق منو قابل‌دسترس هستند .,2
یه سر معایب گف واسه کسا دارن بگ .,0
حت هنگامی‌که صفحه نما Infinity کنار صفحه Retina آ پد نسل سو قرار دهید ، هر دو صفحه نما کیف تقریبا یکسان ارائه می‌دهند تشخیص تفاو دو ، بسیار مشکل .,1
سرع فکس دستگاه حال رنگ حدود دقیقه هر صفحه حال سیاه سفید حدود ۳ ثانیه می‌باشد .,1
مورد دیگر D ۶۰۰ وجود دارد اشاره کرد ، بیشینه شا دوربین ۱ / ثانیه ب نیس .,0
حت دوس اینو داره خاطره ابعاد از ناراض .,0
تشخیص بسیار ضعیف سرع پایین نسب GOOGLE NOW ضعف IOS مشهود نموده_اس .,0
ول ایزو ۳۲۰۰ کاملا نویز .,0
یکم رم پایینه بخاطر برنامه پیش‌فرض گوگل رم همیشه گوشیو حتما باید پره رو کنید بتونید شرشون خلاص شید .,0
حافظه RAM نوت‌بوک نیز بین ۲ ۴ گیگابا البته راحت می‌تو طریق محفظه قسم زیر دستگاه قرار دارد ، ارتقاء داد .,1
جمع بندیهمواره MacBook Pro جزو سر خاص لپ‌تاپ حرفه گران‌قیم اصطلاح « لوکس » بازار بوده_اس بازار هدف لپ‌تاپ افراد محدود هستند .,1
تس استاندارد اینترن طریق Wi-Fi مدل مختلف سایز صفحه نوع پردازنده پردازشگر ، بین ۳:۳۰ ساع شارژده کنند آلترابوک سایر لپ‌تاپ باریک میز نسبتا ضعیف می‌گردد .,0
کیف اسکن عکس رنگ خیل خوب ول همچن ه مشکل رنگ خاکستر چ می‌خورد .,0
من گوش ارز خرید نداره اگه قیمت هم‌اندازه مثل گلکس اس ۳ اچ ت س ایکس باشه نظر من حداقل پردازند باید هسته می‌بود نیس اگه بخوا عمر باتر نظر خیل عقبه,0
ویدئو Tegra تبل نیز ظاهر بسیار خوب برخوردار ول متاسفانه تبل ، همانند اکثر تبلت پردازنده پلیر ۲ استفاده می‌کنند ، نمی‌تواند ویدئو Full HD رو پخ کند .,0
سلا همه دوس اپل باز من ایفون ۲ g ایفون ۵ گرف تما ان راض هس ، بنظر من ایفون ۵ تهیه می‌کنید دیگر لپ‌تاپ نیاز پیدا نمی‌کنید .,2
سلا ، من چند وقته گوشیو دار .,1
پ دوربین نگاه می‌کن کم افسوس می‌خور .,0
نظر کارا بنظر من به گوش هس فعلا میشه استفاده کرد همچنین قیمت بسیار مناسبه ول فقط باتر ضعیف داره,2
ودارا اندروید ۴ ٫ ۱ gpu ۴۰۰ ول مقدار کارکرد نسب مدل ضعیف شده_اس,0
پس یک بگه باید ۲ برابر پول گوش رو داد ؟,1
شاس هیچ جا تح فشار خ نمی‌شود کلید نیز آستانه عمق عملکرد خوب دارند .,2
پور HDMI .,1
گوش بسیار خوبیه ول اگه پردازنده دو هسته عال,2
امک بسیار جالب کاربرد داره .,2
ضمن گوشیمو رو نکرد نخواهم_کرد فقط مشکل اینه صدا شاتر بدون رو قطع نمی‌شه اون راه حل نصب یه برنامه دوربینه عکسبردار فیلمبرداریو بدون صدا انجا می‌ده .,1
ضمن ، دوربین قادر کیف Full HD سرع ۳۰ فر ثانیه فیلم‌بردار نماید .,2
توسط شتاب سنج موجود آیپاد نانو- فوق‌العاده باتر می‌تو مد شبانه‌روز ( ۲۴ ساع ) بدون وقفه آیپاد نانو موسیق گو کرد- پخ عمده فرمت موسیقی- بازار حافظه فل ۸ ۱۶ گیگابایت ( حافظه ۸ گیگابا ۲۰۰۰ عدد موسیق می‌تواند ذخیره کند ) - حمل اتصال لباس توسط گیره - گسترده رنگ- اکثر فرمت عکس- ساع ز شارژ کامل باتری- العاده کوچک ، سبک باریک,2
بنابراین علاوه کیف نمایشگر ، فن‌آور باعث می‌شود تصاویر کیف بسیار بیشتر ببینید .,2
اصلان نگر آویزون شدن جیبتون نباشید سبکه .,2
علاوه امک عکس‌بردار HDR طور پیش‌فرض برنامه دوربین اضافه‌شده .,2
اکثر مدل Sleekbook مدل ولتاژ پایین پردازنده Intel Core AMD سر A استفاده می‌کنند .,1
بنابراین P ۷۷۰۰ انتظار عکس G ۱ x نمی‌رود,0
نظر من اسکنر خوب هس .,2
لپ‌تاپ شیک عال هس نظر گرافیک پر قدر نیس,0
بیاین نظرمون نسب فوج رو عوض کن !,1
می‌دون نقد مقدار طولان هس ول لطفا بخونید به انتخاب کنید پردازنده نرم‌افزار : همونطور می‌دونید تبل دارا پردازنده ۴ هسته استمن خود ایپد دار خواهر تبل خریده واقعا پشیمونه ایپد نخریده ممکنه تبل لحاظ سخ افزار قوی باشه ول خاطر وجود سیستم‌عامل اندروید ۴ هسته اندازه ۱ هسته ایپد کاربرد نداره ایپد کوچک تیک وجود نداره حت حین باز کردن بازی Full HD ول TF ۷۰۰ T وجود پردازنده ۴ هسته مقدار تیک می‌زند چیز هس اون ۴ هسته پردازنده باید استفاده کن بازی سیستم‌عامل ios چندین برابر اندروید نظر کیف نظر تعداد هستند بازی سیستم‌عامل اندروید اصلا ios قابل مقیسه نیس اگه باورتون نمی‌شه ایپد تبل اندروید گیر بیارید app store اپل aundroid market اندروید نگاه بندازید همه بازی app store تو ایر کرک شده پیدا می‌شه خیل راح بدون هیچ هزینه می‌تونید تو ایپدتون بریزید بلوتوث : ایپد فقط بد دا بلوتوث  فقط فرستادن فایل محصول دیگر اپل می‌شد استفاده کرد ول مشکل ios ۶ قرار اخر شهریور بیاید حل می‌شود خیل راح می‌توان فایل هاتون share کنید .,1
قابل دو اضافه‌شده نیز مربوط برنامه مسیجینگ .,1
همچنین فایل تصویر فرمت نظیر MP ۴ ، WMV ، AVI رو گوش قابل پخ هستند .,1
رزولوشن تغییر کرده باعث میشه بسیار نرم‌افزار بازی خط سیاه دو طرف نمایشگر قرار بگیره ، البته اعلام‌شده نرم‌افزار به‌روز خواهند_شد .,1
صدا خوب داره,2
عنو گوش تلفن همراه چنین ویژگی فناوری خیره‌کننده ، Galaxy S II گوش آسان جمع‌بند اظهار نظر .,2
سلا من هفته دوربین رو خریدار کرد اولین نکته دوربین ساخ چین دو اینکه مود دست رنگ عکاس استاندارد کر سیاه سفید دارد شما عکس کر نمی‌توانید بگیرید فقط سیاه سفید استاندارد میتو انتخاب کرد سو اینکه توجه قیم عکس خوب نمی‌تو گرف فقط کار راه‌انداز,0
راست اول جعبه درآوردم بخاطر کیف بدن خیل تو ذوق خورد انتخاب پشیمون شد ول وقت عکس گرفتن رو با شروع کرد احساس کاملا عوض !,2
جز دوربین دو ۲ مگاپیکسل بالا صفحه نما قرار دارد ، هیچ‌گونه کلید پور دیگر قسم جلو تبل وجود ندارد .,1
خیل عالیه !,2
امکانات گوش داره ، قیم خیل مناسبه بنچ مارک نرم‌افزار antutu benchmark گرف رو براتون می‌نویس .,2
پردازنده خوب داره پس کارا روزمره برمیاد .,2
ول هر ویژگ ، یک آن خاص .,1
صور کافیس آن محل کار ، ماشین منزل بچسبانید تنظ هر کدا نیز مطابق میل انجا دهید مثلا محل کار تنظ مربوط Wi-Fi ، Data Network ، میز صدا ، Wi-Fi hotspot بلوتوث ماشین تنظ مربوط مسیر یاب ، مقصد ، بلوتوث موزیک شخص ساز نمود .,1
نسل جدید لپ‌تاپ MacBook Pro قابل Retina Display تن سایز ۱۵ ٫ ۴ اینچ عرضه می‌شود دارا مشخص رویا سیس قابل‌حمل می‌باشد .,1
خیل تلویزیون خوبیه من ب کار وا فا دار عالیه نظر من بهترینه,2
نو ۲ تن رقیبشه الج خلاف مدل قبل گوشی مثل ۴ x خود خریدم نکسوس واقعا فوق‌العاده هستن ضعیف عمل کرده من گوش کار کرد مکالمه با خیل سخته .,0
نوع دو درایو نور ، توسط شرک توشیبا سامسونگ طراح جایگزین درایو قبل کنسول گردید .,1
دکمه Select زیر نمایشگر وجود دارد طور واضح دکمه select موجود رو iPhone کوچک می‌باشد .,1
ن گوش سون اریکسون Live with Walkman توجه قیم بسیار خوب دارد ، گوش فوق‌العاده محسوب می‌شود .,2
موفق پیروز باشید,2
کیف دسکتاپ چنگ دل نمیزنه .,0
من هفته گوش دار گوش بسیار عال .,2
یعن gprs edge .,1
همانطور دوربین ۵۵۰ D می‌توانست ۷ D کوچک بنام دوربین ۵۰۰ D ۵۰ D کوچک .,1
باند می‌تو خروج پرینتر لیزر . مشاهده کرد ارزان‌قیمت,0
سیستم‌عامل iOS نرم‌افزار کن با بر کامپیو دانلود کن اونوق بیا تو .,0
لنز دوربین لنز معادل ۲۸ - ۱۲۸ میلی توانا زو ۴ ٫ ۶ برابر می‌باشد .,1
بنظر من فقط چیز موبایل نادرست کیف دوربین,0
محصول تن دید تحسین نگاه مسیر اشتباه رفته ، معمولا آنچن سابقه اپل خاطر شرک نقاط محصول خود رو سایه پر زرق برق پنه می‌کنه .,0
مشخصه اصل دوربین فیلمبردار JVC GZ-MG ۳۳۵ • ابعاد : ۷۶ * ۶۸ * ۱۱۳ میل متر• وزن : ۳۱۰ گر ، بدون باتری• صفحه نما TFT اندازه ۲ ٫ ۷ اینچ تعداد ۱۲۳۰۰۰ پیکسل• زو اپتیکال ۳۵ برابر زو دیجیتال ۸۰۰ برابر• لرز گیر تصویر دیجیتال• باتر یون لیتیو استاندارد• مجهز کنترل راه دور• ذخیره‌ساز فیل قالب MPEG ۲ • مجهز خروج کامپیو تلویزیون• دوربین مجهز فوکوس خودکار,2
نقاط قو : ۱.,1
تن از میشه مشکلیه گرف !,0
پس همین گزینه بهتر هس !,2
صفحه نما صفحه نما موجود رو تبل صفحه نما ۱۰ ٫ ۱ اینچ لمس خازن نوع IPS LCD می‌باشد دارا رزولوشن ۸۰۰ × ۱۲۸۰ می‌باشد .,1
به گوش موجود بازار,2
لنز رو P ۵۲۰ استفاده‌شده دقیقا همان رو مدل پیشین وجود دا .,1
دوربین دوربین گوش دوربین ۵ مگاپیکسل عکس رزولوشن ۱۹۳۶ × ۲۵۹۲ پیکسل ثب می‌نماید .,1
صدا کیف ب همه به سخت‌افزار قو جزو به ویژگ هاشه !,2
بزرگه نظر .,0
لحاظ نرم‌افزار قیم بدون رقیب هس بنده نظر همین تبل درج کرد ول نباید انکار کرد تبل عیب بزرگ دارد آنه پشتیبان نکردن حافظه جانب هس ول لحاظ سرع قدر نرم‌افزار تبلت گر قیمت مانند ۷ plus بسیار بالا صفحه نما اینکه سوپر امولد نیس کیف بالا نور ده بسیار مناسب دارد رنگ بسیار زنده‌اند آخر بدنه پشت مورد برس قرار می‌گیرد موقع کار کرد حس بسیار خوب منتقل می‌کند عرق دس جلو گیر می‌کند درمورد حافظه می‌تو گف وجود کم حافظه  راه‌حل مانند استفاده حافظه استفاده یو اس ب تبل وصل می‌شوند استفاده کرد مثل فلش هارد اکس نال استفاده حافظه مجاز مانند گوگل درایو دراپ باکس پس خرید تبل لزوم توجه حافظه نیس زیرا می‌تو اطلاع جا دیگر ذخیره کرد,2
میتونید خودتون تس بنچمارک بگیرید سایت رو چک کنید .,1
واقعا عال اصلا عملکرد تو سایتا سنگین کند نشد .,2
میتونید مقایسه مشخص دوگوش نتیجه برسید .,1
ن قطر اعجاب‌انگیز آن‌که تن ۷ ٫ ۶ میلی می‌باشد .,2
همچنین مدل pro .,1
بله ، گلکس اس ۳ یک به گوشی هوشمند ساخته‌شده تاریخ جانشین مناسب گوش محبوب Galaxy S II خواهد_بود .,2
پیچ تنظ شوتینگ مود جا می‌توانید Scene Mode مود صحنه جا بیابید .,1
ول دکمه یک نزدیک lcd هستند اکثرا افراد یک پایین رو لمس می‌کنند همین فکر می‌کنند دکمه ضعیفند !,1
صدا بقیه اندروید بلندتره .,2
دوس من ماه قبل دوربین خرید بعد دو روز فروخ .,0
خصوص پ دوربین نگاه کن ، چین دکمه دقیقا مثل ۶۰ D می‌باشد .,1
جمله می‌تو طراح ساخ بسیار کیف ارگونومیک ، مود عکاس حرفه ، توانا ضبط ویدیو ۱۰۸۰ p Full HD ، سنسور بسیار پیشرفته کیف ، نمایشگر خیل خوب همه به لنز توانا زو ۱۵ برابر اشاره کرد .,2
براق بودن بدنه ، باعث شده_اس CQ ۵۸ حد زیاد مستعد جذب اثر انگ گرد خاک .,0
"جمله کاربر تازه‌کار هستید می‌توانید مود اتوماتیک انتخاب کنید مود P,A,S,M نیز عکاس خلاقانه کار می‌روند .",2
دوما : نورگیر  بسیار ک ودر شرایط نور ک تصویر بسیار بی‌کیف می‌شود .,0
گوش خیل عال هس .,2
ابعاد پرین خیل جمع جور می‌باشد .,2
لب تاب نظر گرافیک خیل خوبه همچنین سیس خنک کنندگ خوب داره فقط وقت باز سنگین لب تاب می‌کنید کم هواک گرما بیرون میده طبیع هست بدنه خیل خوب داره .,2
دق صفحه نما تما مدل ۱۳۶۶ × ۷۶۸ می‌باشد دق استاندارد متوسط محسوب می‌گردد .,1
ول همه چیز بنچ مارک نیس .,1
البته جنس گونه ایس براق بوده خط خ کم می‌پذیرد .,0
هم‌چنین ، ریجن J / Asia J لحاظ اجرا بازی ریجن‌فر متفاو هستند .,1
Vivo Tab عنو لپ‌تاپ پیشنهاد نمی‌کن همچن کیبورد آن‌را قطعه لواز جانب می‌دان کارایی بسیار دارد ، عنو لپ‌تاپ ، انتظار کاربر سخت برآورده می‌شود .,1
هرچند لنز ه فاصله کانون ۲۸ - ۲۰۰ میلی پوش می‌دهد بزرگنما حد ۷ برابر می‌تواند ایجاد کند ، حال لنز لنز رو دو مدل قبل وجود دا کاملا سریع .,2
دارم .,1
جا دو تا آخر مناسب نیس ال سی‌د کابل وصل شوند مناسب نیس . فیل گرفتن موقع اتصال تلویزیون کم سخ می‌کند حرک,0
عقیده من Apple می‌توانس . بزرگتر بهره ببرد تما صفحه بگیرند آیکون,0
خدا کنه حداقل گارانت ضعف ایسوس پوش داده بشه وگرنه اینکه تبلت بسیار بسیار فوق‌العاده توصیه می‌کن خریدن عجله نکنید همین سا نحوه رو گارانت پوش اطلاع مید,0
• سخت‌افزار داخل همان‌طور گفت نوت‌بوک کانفیگ نسبتا متنوع البته قدرتمند ساخته‌شده .,2
مود عکاس مختلف رو دوربین قرار گرفته‌اند .,1
گوش کیف مناسبیه ارز خرید بالا داره نظر من دوربین کیف مناسب داره همچنین کیف ساخ بدنه گوشی سون اریکسون خوبه یه ک قطر زیاده اون امک زیاد داره میشه نادیده گرف,2
انصافا رو دست ندید .,2
• طراح ساخ همان‌طور گفت ، ASUS X کیف ساخت بسیار بالا دارد .,2
قیم گوش امکانات داره واقعا مناسبه .,2
سون بروز رسان رو اساس SL Number جا اون زیر باطر هس انجا می‌ده طبق لیس وب‌سا سون هنوز واسه ما نیومده .,1
یه برنامه ۳ بعد کردن عکس داره حالا زیاد انتظار بالا نداشته باشین نر افزاره ول امتحان میارزه یه مورد معایب اینه اگه وسایل مثل کیس هر چیز دیگه می‌خواین پور SVIDEO وصل کنید ورود SVIDEO نمی‌خوره,0
تن دشواری داره تایپ کردنه .,0
با فلا ۱ سال جلو نو ۲ هست,1
من هارد رو دیج کالا خرید ، خرید واقعا راض هس .,2
نظر عملکرد حساسیت مختلف باید گف تن ایزو ۸۰۰ می‌تواند مقدار مشکل‌ساز باشد,0
تبل داشتن فتوشاپ بصور پیش‌فرض ، شاهکار طراح صنعت گرافیک .,2
شاید دلیل دراین مدل برخلاف مدل قبل xr- ۵۲۰ فلا بالا قرار دارد فلا xr- ۵۲۰ شده_اس . ۳ -منو مدل کم پیچیده نظر می‌رسد مطالب بالا فقط ب اشکال شخص دیگر شاید چ نیاید .,0
متاسفانه دکمه باید پاک کردن عکس گرفته‌شده رو بدنه دیده_نمی‌شود Delete طریق منو کار انجا داد پاک کردن هر عکس رو کار حافظه دست‌ک ۶ کلیک نیاز .,0
تست انجام‌شده ، گوش بدون هیچ مشکل بازی HD نیز اجرا کرد تقریبا می‌تو گف اجرا تمام برنامه ، بسیار رو عمل نمود .,2
متاسفانه گوش مکالمه تصویر مبتن شبکه سو رایتل رو پشتیبان .,0
استاندارد نظام IPX ۷ ۵۲۹ نظر سازند داره چند بار کرد جواب میده همیشه گف تن ایرادا انعطاف کابلشه هارد فشار میاره امیدوار باشه یک دیگ اینکه سوک سم هارد نمیدون چه استاندارد هس اگه usb به البته سازند دید علت چ بوده,0
تس پرین ۵ صفحه ما ۲۷ ثانیه طول انجامید برابر چیز حدود ۱۱ ٫ ۱ صفحه دقیقه .,1
"سامسونگ واقعا ساخ لپ‌تاپ توجه قیم پایین دارند ، طراح مواد اولیه فوق‌العاده خوب کار برده اصطلاح "" سنگ تما گذاشته_اس !",2
نظیر نداره بهترینه گوش هاس,2
کل ، اینکه عکاس تبل همواره جزو موارد غیر ضرور نامیده ، ول مورد دستگاه کسان علاقه‌مند عکاس نیز هستند ، هواو شرایط فراه نموده_اس کاملا آن راض خواهد_نمود .,2
بدین ترتیب وقت بزرگنمایی بالا حال عکاس سوژه هستید ، لرز دس شما منجر تار شدن تصویر گردد .,0
